[
  {
    "name": "expected_rows",
    "status": "PASS",
    "expected": 4439,
    "expected_source": "expected/frame_windows.count:count",
    "observed": 4439,
    "missing": null
  },
  {
    "name": "expected_rows_tol",
    "status": "PASS",
    "expected": 88,
    "expected_source": "expected/expected_rows_tol.count:count",
    "observed": 88,
    "missing": null
  },
  {
    "name": "expected_rows_tol_cap",
    "status": "PASS",
    "expected": 88,
    "expected_source": "frame.yaml:expected_rows",
    "observed": 88,
    "missing": null
  },
  {
    "name": "expected_rows_source",
    "status": "PASS",
    "expected": "sql/count_windows_ab.sql",
    "expected_source": "frame.yaml:expected_rows_source",
    "observed": "sql/count_windows_ab.sql",
    "missing": null
  },
  {
    "name": "comparisons_m",
    "status": "PASS",
    "expected": 3,
    "expected_source": "expected/comparisons_m.count:count",
    "observed": 3,
    "missing": null
  },
  {
    "name": "comparison_ids",
    "status": "PASS",
    "expected": "c1_period_drop,c2_highsnr_onset_residual,c3_singing_removal",
    "expected_source": "expected/comparison_ids.txt:ids",
    "observed": "c1_period_drop,c2_highsnr_onset_residual,c3_singing_removal",
    "missing": null
  },
  {
    "name": "min_judgeable",
    "status": "PASS",
    "expected": 200,
    "expected_source": "expected/min_judgeable.count:count",
    "observed": 200,
    "missing": null
  },
  {
    "name": "B",
    "status": "PASS",
    "expected": 1000,
    "expected_source": "expected/B.count:count",
    "observed": 1000,
    "missing": null
  },
  {
    "name": "B_ge_1000",
    "status": "PASS",
    "expected": 1000,
    "expected_source": "expected/B.count:count",
    "observed": 1000,
    "missing": null
  },
  {
    "name": "baseline_model",
    "status": "PASS",
    "expected": "agreement_pre2025",
    "expected_source": "expected/baseline_model.txt:value",
    "observed": "agreement_pre2025",
    "missing": null
  },
  {
    "name": "video_counts",
    "status": "PASS",
    "expected": 567,
    "expected_source": "expected/n_videos.count:count",
    "observed": 567,
    "missing": null
  },
  {
    "name": "singing_prob_path",
    "status": "PASS",
    "expected": "task2_window_quality/window_quality_with_flags.csv",
    "expected_source": "expected/singing_prob_path.txt:path",
    "observed": "task2_window_quality/window_quality_with_flags.csv",
    "missing": null
  },
  {
    "name": "singing_prob_path_matches_round_yaml",
    "status": "PASS",
    "expected": "task2_window_quality/window_quality_with_flags.csv",
    "expected_source": "rounds/ROUND-3.yaml:singing_prob_source.path",
    "observed": "task2_window_quality/window_quality_with_flags.csv",
    "missing": null
  },
  {
    "name": "paired_with_clap",
    "status": "PASS",
    "expected": false,
    "expected_source": "expected/paired_with_clap.txt:value",
    "observed": false,
    "missing": null
  },
  {
    "name": "status_codes_no_unknown_other",
    "status": "PASS",
    "expected": [
      "ok"
    ],
    "expected_source": "frame.yaml:status_codes",
    "observed": [
      "ok",
      "missing",
      "empty_realized",
      "dur_le_0",
      "excluded",
      "inconclusive"
    ],
    "missing": null
  },
  {
    "name": "groups_explicit_not_complement",
    "status": "PASS",
    "expected": "explicit predicates",
    "expected_source": "frame.yaml:groups.control.predicate",
    "observed": "contemporary_only = 1",
    "missing": null
  },
  {
    "name": "barred_stratifiers_not_groups",
    "status": "PASS",
    "expected": [],
    "expected_source": "frame.yaml:barred_stratifiers",
    "observed": [],
    "missing": null
  },
  {
    "name": "tier_whitelist_ab",
    "status": "PASS",
    "expected": [
      "A",
      "B"
    ],
    "expected_source": "frame.yaml:tier_whitelist",
    "observed": [
      "A",
      "B"
    ],
    "missing": null
  },
  {
    "name": "predicates_include_tier",
    "status": "PASS",
    "expected": "windows.tier IN ('A', 'B')",
    "expected_source": "frame.yaml:predicates",
    "observed": [
      "windows.tier IN ('A', 'B')"
    ],
    "missing": null
  },
  {
    "name": "sql_explain_c1_period_drop",
    "status": "PASS",
    "expected": "explain ok",
    "expected_source": "frame.yaml:expected_rows_source",
    "observed": "explain ok",
    "missing": null
  },
  {
    "name": "sql_explain_c2_highsnr_onset",
    "status": "PASS",
    "expected": "explain ok",
    "expected_source": "frame.yaml:expected_rows_source",
    "observed": "explain ok",
    "missing": null
  },
  {
    "name": "sql_explain_c3_singing_removal",
    "status": "PASS",
    "expected": "explain ok",
    "expected_source": "frame.yaml:expected_rows_source",
    "observed": "explain ok",
    "missing": null
  },
  {
    "name": "sql_explain_count_windows_ab",
    "status": "PASS",
    "expected": "explain ok",
    "expected_source": "frame.yaml:expected_rows_source",
    "observed": "explain ok",
    "missing": null
  },
  {
    "name": "sql_explain_join_syllables_windows",
    "status": "PASS",
    "expected": "explain ok",
    "expected_source": "frame.yaml:expected_rows_source",
    "observed": "explain ok",
    "missing": null
  },
  {
    "name": "sql_explain_join_windows_videos",
    "status": "PASS",
    "expected": "explain ok",
    "expected_source": "frame.yaml:expected_rows_source",
    "observed": "explain ok",
    "missing": null
  },
  {
    "name": "assertion_message_set",
    "status": "PASS",
    "expected": "equal",
    "expected_source": "expected/assertion_messages.flag:equal",
    "observed": {
      "only_src": [],
      "only_tests": []
    },
    "missing": null
  },
  {
    "name": "pd_merge_only_checked_merge",
    "status": "PASS",
    "expected": [],
    "expected_source": "frame.yaml:joins",
    "observed": [],
    "missing": null
  },
  {
    "name": "select_from_only_load_sql",
    "status": "PASS",
    "expected": [],
    "expected_source": "frame.yaml:expected_rows_source",
    "observed": [],
    "missing": null
  },
  {
    "name": "no_absolute_src_paths",
    "status": "PASS",
    "expected": [],
    "expected_source": "frame.yaml:expected_rows_source",
    "observed": [],
    "missing": null
  },
  {
    "name": "path_args_no_default",
    "status": "PASS",
    "expected": [],
    "expected_source": "frame.yaml:expected_rows_source",
    "observed": {
      "argparse": [],
      "getenv": false
    },
    "missing": null
  },
  {
    "name": "no_measure_fillna_or_get_default",
    "status": "PASS",
    "expected": [],
    "expected_source": "frame.yaml:measure_columns",
    "observed": {
      "snippets": [],
      "get_two_args": false
    },
    "missing": null
  },
  {
    "name": "frame_yaml_blob_sha",
    "status": "PASS",
    "expected": "cd65e3bfcc9d2b6b042a0079afea55df5667a4e3",
    "expected_source": "frame.yaml:expected_rows",
    "observed": "cd65e3bfcc9d2b6b042a0079afea55df5667a4e3",
    "missing": null
  },
  {
    "name": "no_not_supported_phrase",
    "status": "PASS",
    "expected": [],
    "expected_source": "expected/comparison_ids.txt:ids",
    "observed": [],
    "missing": null
  },
  {
    "name": "measure_status_in_output_schemas",
    "status": "PASS",
    "expected": [],
    "expected_source": "frame.yaml:measure_columns",
    "observed": [],
    "missing": null
  },
  {
    "name": "mutations_killed",
    "status": "PASS",
    "expected": "killed",
    "expected_source": "expected/comparison_ids.txt:ids",
    "observed": [
      "join_key_swapped.patch",
      "sentinel_written_with_status_ok.patch",
      "stratum_seed_replaced_by_master.patch",
      "stratum_weights_set_to_1.patch",
      "tier_filter_removed.patch"
    ],
    "missing": null
  },
  {
    "name": "unmutated_skip_policy",
    "status": "PASS",
    "expected": [],
    "expected_source": "frame.yaml:expected_rows_source",
    "observed": [],
    "missing": null
  }
]
